"Balaji O.","Balaji, O. (57073916500)","57073916500","Pharmacotherapy of non-small cell lung cancer: A short review","2018","Asian Journal of Pharmaceutical and Clinical Research","11","3","","7","10","3","0","10.22159/ajpcr.2018.v11i3.23253","https://www.scopus.com/inward/record.uri?eid=2-s2.0-85042908405&doi=10.22159%2fajpcr.2018.v11i3.23253&partnerID=40&md5=6ffcf4b493198d77b5f16535c876ef79","Department of Pharmacology, Kasturba Medical College, Manipal University, Manipal, Karnataka, India","Balaji O., Department of Pharmacology, Kasturba Medical College, Manipal University, Manipal, Karnataka, India","O. Balaji; Department of Pharmacology, Kasturba Medical College, Manipal University, Manipal, India; email: puntermmc@gmail.com","","Innovare Academics Sciences Pvt. Ltd","09742441","","","","English","Asian J. Pharm. Clin. Res.","Review","Final","All Open Access; Gold Open Access","Scopus","2-s2.0-85042908405"
"Pérez-Ramírez C.; Cañadas-Garre M.; Alnatsha A.; Villar E.; Valdivia-Bautista J.; Faus-Dáder M.J.; Calleja-Hernández M.Á.","Pérez-Ramírez, Cristina (56648090200); Cañadas-Garre, Marisa (37049790400); Alnatsha, Ahmed (57190736958); Villar, Eduardo (57206442138); Valdivia-Bautista, Javier (35270740400); Faus-Dáder, María José (7003479396); Calleja-Hernández, Miguel Ángel (55903321600)","56648090200; 37049790400; 57190736958; 57206442138; 35270740400; 7003479396; 55903321600","Pharmacogenetics of platinum-based chemotherapy: impact of DNA repair and folate metabolism gene polymorphisms on prognosis of non-small cell lung cancer patients","2019","Pharmacogenomics Journal","19","2","","164","177","13","23","10.1038/s41397-018-0014-8","https://www.scopus.com/inward/record.uri?eid=2-s2.0-85045431859&doi=10.1038%2fs41397-018-0014-8&partnerID=40&md5=0fe9724ad6f319285cab17852614173a","Pharmacogenetics Unit, UGC Provincial de Farmacia de Granada, Instituto de Investigación Biosanitaria de Granada, Complejo Hospitalario Universitario de Granada, Avda. Fuerzas Armadas, 2, Granada, Spain; Department of Biochemistry, Faculty of Pharmacy, University of Granada, Campus Universitario de Cartuja, s/n, Granada, 18071, Spain; Centre for Public Health, Nephrology Research Group, Queen’s University Belfast, c/o Regional Genetics Centre, Level A Tower Block Belfast City Hospital Lisburn Road, Belfast, BT9 7AB, United Kingdom; Department of Molecular Medicine, Faculty of Medicine, University of Tübingen, Geissweg 5, Tübingen, 72076, Germany; Pathology Service, UGC Anatomía Patológica, Instituto de Investigación Biosanitaria de Granada Complejo Hospitalario Universitario de Granada, Avda. Fuerzas Armadas, 2, Granada, 18014, Spain; Medical Oncology Service, UGC Oncología Médica Instituto de Investigación Biosanitaria de Granada, Complejo Hospitalario Universitario de Granada, Avda. Fuerzas Armadas, 2, Granada, 18014, Spain; Department of Pharmacology, Faculty of Pharmacy, University of Granada, Campus Universitario de Cartuja, s/n, Granada, 18071, Spain","Pérez-Ramírez C., Pharmacogenetics Unit, UGC Provincial de Farmacia de Granada, Instituto de Investigación Biosanitaria de Granada, Complejo Hospitalario Universitario de Granada, Avda. Fuerzas Armadas, 2, Granada, Spain, Department of Biochemistry, Faculty of Pharmacy, University of Granada, Campus Universitario de Cartuja, s/n, Granada, 18071, Spain; Cañadas-Garre M., Centre for Public Health, Nephrology Research Group, Queen’s University Belfast, c/o Regional Genetics Centre, Level A Tower Block Belfast City Hospital Lisburn Road, Belfast, BT9 7AB, United Kingdom; Alnatsha A., Department of Molecular Medicine, Faculty of Medicine, University of Tübingen, Geissweg 5, Tübingen, 72076, Germany; Villar E., Pathology Service, UGC Anatomía Patológica, Instituto de Investigación Biosanitaria de Granada Complejo Hospitalario Universitario de Granada, Avda. Fuerzas Armadas, 2, Granada, 18014, Spain; Valdivia-Bautista J., Medical Oncology Service, UGC Oncología Médica Instituto de Investigación Biosanitaria de Granada, Complejo Hospitalario Universitario de Granada, Avda. Fuerzas Armadas, 2, Granada, 18014, Spain; Faus-Dáder M.J., Department of Biochemistry, Faculty of Pharmacy, University of Granada, Campus Universitario de Cartuja, s/n, Granada, 18071, Spain; Calleja-Hernández M.Á., Pharmacogenetics Unit, UGC Provincial de Farmacia de Granada, Instituto de Investigación Biosanitaria de Granada, Complejo Hospitalario Universitario de Granada, Avda. Fuerzas Armadas, 2, Granada, Spain, Department of Pharmacology, Faculty of Pharmacy, University of Granada, Campus Universitario de Cartuja, s/n, Granada, 18071, Spain","M. Cañadas-Garre; Pharmacogenetics Unit, UGC Provincial de Farmacia de Granada, Instituto de Investigación Biosanitaria de Granada, Complejo Hospitalario Universitario de Granada, Granada, Avda. Fuerzas Armadas, 2, Spain; email: marisacgarre@gmail.com","","Nature Publishing Group","1470269X","","PJHOA","29662106","English","Pharmacogenomics J.","Article","Final","All Open Access; Green Open Access","Scopus","2-s2.0-85045431859"
"Liao W.-Y.; Ho C.-C.; Tsai T.-H.; Chen K.-Y.; Shih J.-Y.; Yu C.-J.","Liao, Wei-Yu (7203056934); Ho, Chao-Chi (7404653038); Tsai, Tzu-Hsiu (7401925775); Chen, Kuan-Yu (55683537600); Shih, Jin-Yuan (7201813205); Yu, Chong-Jen (7404977466)","7203056934; 7404653038; 7401925775; 55683537600; 7201813205; 7404977466","Combined effect of ERCC1 and ERCC2 polymorphisms on overall survival in non-squamous non-small-cell lung cancer patients treated with first-line pemetrexed/platinum","2018","Lung Cancer","118","","","90","96","6","15","10.1016/j.lungcan.2018.01.011","https://www.scopus.com/inward/record.uri?eid=2-s2.0-85041899355&doi=10.1016%2fj.lungcan.2018.01.011&partnerID=40&md5=5a95e666776c850984e623cd1c0050c6","Department of Internal Medicine, National Taiwan University Hospital and National Taiwan University College of Medicine, Taipei, Taiwan","Liao W.-Y., Department of Internal Medicine, National Taiwan University Hospital and National Taiwan University College of Medicine, Taipei, Taiwan; Ho C.-C., Department of Internal Medicine, National Taiwan University Hospital and National Taiwan University College of Medicine, Taipei, Taiwan; Tsai T.-H., Department of Internal Medicine, National Taiwan University Hospital and National Taiwan University College of Medicine, Taipei, Taiwan; Chen K.-Y., Department of Internal Medicine, National Taiwan University Hospital and National Taiwan University College of Medicine, Taipei, Taiwan; Shih J.-Y., Department of Internal Medicine, National Taiwan University Hospital and National Taiwan University College of Medicine, Taipei, Taiwan; Yu C.-J., Department of Internal Medicine, National Taiwan University Hospital and National Taiwan University College of Medicine, Taipei, Taiwan","C.-J. Yu; Department of Internal Medicine, National Taiwan University Hospital, Taipei, # 7, Chung-Shan South Rd, 100, Taiwan; email: jefferycjyu@ntu.edu.tw","","Elsevier Ireland Ltd","01695002","","LUCAE","29572009","English","Lung Cancer","Article","Final","","Scopus","2-s2.0-85041899355"
"More S.S.; Li S.; Yee S.W.; Chen L.; Xu Z.; Jablons D.M.; Giacomini K.M.","More, Swati S. (15064295400); Li, Shuanglian (14047025700); Yee, Sook Wah (7101945227); Chen, Ligong (55739193800); Xu, Zhidong (7405423384); Jablons, David M. (7005483968); Giacomini, Kathleen M. (7007004069)","15064295400; 14047025700; 7101945227; 55739193800; 7405423384; 7005483968; 7007004069","Organic cation transporters modulate the uptake and cytotoxicity of picoplatin, a third-generation platinum analogue","2010","Molecular Cancer Therapeutics","9","4","","1058","1069","11","65","10.1158/1535-7163.MCT-09-1084","https://www.scopus.com/inward/record.uri?eid=2-s2.0-77950823207&doi=10.1158%2f1535-7163.MCT-09-1084&partnerID=40&md5=7c39be323094bd608e0f863371533f42","Department of Bioengineering and Therapeutic Sciences, University of California, San Francisco, CA 94158, 1550 4th Street, Argentina; Department of Surgery, Comprehensive Cancer Center, University of California, San Francisco, CA, Argentina","More S.S., Department of Bioengineering and Therapeutic Sciences, University of California, San Francisco, CA 94158, 1550 4th Street, Argentina; Li S., Department of Bioengineering and Therapeutic Sciences, University of California, San Francisco, CA 94158, 1550 4th Street, Argentina; Yee S.W., Department of Bioengineering and Therapeutic Sciences, University of California, San Francisco, CA 94158, 1550 4th Street, Argentina; Chen L., Department of Bioengineering and Therapeutic Sciences, University of California, San Francisco, CA 94158, 1550 4th Street, Argentina; Xu Z., Department of Surgery, Comprehensive Cancer Center, University of California, San Francisco, CA, Argentina; Jablons D.M., Department of Surgery, Comprehensive Cancer Center, University of California, San Francisco, CA, Argentina; Giacomini K.M., Department of Bioengineering and Therapeutic Sciences, University of California, San Francisco, CA 94158, 1550 4th Street, Argentina","K. M. Giacomini; Department of Bioengineering and Therapeutic Sciences, University of California, San Francisco, CA 94158, 1550 4th Street, Argentina; email: kathy.giacomini@ucsf.edu","","","15357163","","MCTOC","20371711","English","Mol. Cancer Ther.","Article","Final","All Open Access; Bronze Open Access","Scopus","2-s2.0-77950823207"
"Moyer A.M.; Sun Z.; Batzler A.J.; Li A.; Schaid D.J.; Yang P.; Weinshilboum R.M.","Moyer, Ann M. (8563298100); Sun, Zhifu (7404240192); Batzler, Anthony J. (15122001800); Li, Ang (49761609700); Schaid, Daniel J. (7006237594); Yang, Ping (56437082300); Weinshilboum, Richard M. (7102831484)","8563298100; 7404240192; 15122001800; 49761609700; 7006237594; 56437082300; 7102831484","Glutathione pathway genetic polymorphisms and lung cancer survival after platinum-based chemotherapy","2010","Cancer Epidemiology Biomarkers and Prevention","19","3","","811","821","10","43","10.1158/1055-9965.EPI-09-0871","https://www.scopus.com/inward/record.uri?eid=2-s2.0-77949674534&doi=10.1158%2f1055-9965.EPI-09-0871&partnerID=40&md5=e0f51775c1158dc9f894aae6a1aa04d7","Division of Clinical Pharmacology, Department of Molecular Pharmacology and Experimental Therapeutics, Rochester, MN, United States; Division of Epidemiology, Department of Health Sciences Research, Rochester, MN, United States; Division of Biostatistics and Bioinformatics, Department of Health Sciences Research, Mayo Clinic, Rochester, MN, United States","Moyer A.M., Division of Clinical Pharmacology, Department of Molecular Pharmacology and Experimental Therapeutics, Rochester, MN, United States; Sun Z., Division of Epidemiology, Department of Health Sciences Research, Rochester, MN, United States; Batzler A.J., Division of Biostatistics and Bioinformatics, Department of Health Sciences Research, Mayo Clinic, Rochester, MN, United States; Li A., Division of Clinical Pharmacology, Department of Molecular Pharmacology and Experimental Therapeutics, Rochester, MN, United States; Schaid D.J., Division of Biostatistics and Bioinformatics, Department of Health Sciences Research, Mayo Clinic, Rochester, MN, United States; Yang P., Division of Epidemiology, Department of Health Sciences Research, Rochester, MN, United States; Weinshilboum R.M., Division of Clinical Pharmacology, Department of Molecular Pharmacology and Experimental Therapeutics, Rochester, MN, United States","R. M. Weinshilboum; Department of Molecular Pharmacology and Experimental Therapeutics, Mayo Clinic, Rochester, MN 55905, 200 First Street Southwest, United States; email: weinshilboum.richard@mayo.edu","","","10559965","","CEBPE","20200426","English","Cancer Epidemiol. Biomarkers Prev.","Article","Final","All Open Access; Bronze Open Access; Green Open Access","Scopus","2-s2.0-77949674534"
"Han Z.-G.; Tao J.; Yu T.-T.; Shan L.","Han, Zhi-Gang (16549553900); Tao, Jie (56037881600); Yu, Ting-Ting (59064684200); Shan, Li (36115458800)","16549553900; 56037881600; 59064684200; 36115458800","Effect of GSTP1 and ABCC2 polymorphisms on treatment response in patients with advanced non-small cell lung cancer undergoing platinum-based chemotherapy: A study in a Chinese Uygur population","2017","Medical Science Monitor","23","","","1999","2006","7","13","10.12659/MSM.904156","https://www.scopus.com/inward/record.uri?eid=2-s2.0-85018450083&doi=10.12659%2fMSM.904156&partnerID=40&md5=384c43d4b2680d99a37bd557039fdbed","Department of Thoracic Oncology, Tumor Hospital Affiliated to Xinjiang Medical University, Urumqi, Xinjiang, China","Han Z.-G., Department of Thoracic Oncology, Tumor Hospital Affiliated to Xinjiang Medical University, Urumqi, Xinjiang, China; Tao J., Department of Thoracic Oncology, Tumor Hospital Affiliated to Xinjiang Medical University, Urumqi, Xinjiang, China; Yu T.-T., Department of Thoracic Oncology, Tumor Hospital Affiliated to Xinjiang Medical University, Urumqi, Xinjiang, China; Shan L., Department of Thoracic Oncology, Tumor Hospital Affiliated to Xinjiang Medical University, Urumqi, Xinjiang, China","L. Shan; Department of Thoracic Oncology, Tumor Hospital Affiliated to Xinjiang Medical University, Urumqi, China; email: xjshanli@163.com","","International Scientific Literature Inc.","12341010","","MSMOF","28442702","English","Med. Sci. Monit.","Article","Final","All Open Access; Green Open Access","Scopus","2-s2.0-85018450083"
"Qian J.; Liu H.; Gu S.; Wu Q.; Zhao X.; Wu W.; Wang H.; Wang J.; Chen H.; Zhang W.; Wei Q.; Jin L.; Lu D.","Qian, Ji (8530125200); Liu, Hongliang (37077536400); Gu, Shaohua (7202220494); Wu, Qihan (7404602342); Zhao, Xueying (55353240400); Wu, Wenting (59114958200); Wang, Haijian (57203774454); Wang, Jiucun (57221357827); Chen, Hongyan (55675224344); Zhang, Wei (56723030600); Wei, Qingyi (7201691656); Jin, Li (36815180100); Lu, Daru (57223736435)","8530125200; 37077536400; 7202220494; 7404602342; 55353240400; 59114958200; 57203774454; 57221357827; 55675224344; 56723030600; 7201691656; 36815180100; 57223736435","Genetic Variants of the MDM2 Gene Are Predictive of Treatment-Related Toxicities and Overall Survival in Patients With Advanced NSCLC","2015","Clinical Lung Cancer","16","5","354","e37","e53","16","11","10.1016/j.cllc.2015.02.001","https://www.scopus.com/inward/record.uri?eid=2-s2.0-84941418327&doi=10.1016%2fj.cllc.2015.02.001&partnerID=40&md5=ec3095cb0228b8eea27e20da37d72acc","Fudan University Shanghai Cancer Center, Department of Oncology, Fudan University Shanghai Medical College, Shanghai, China; State Key Laboratory of Genetic Engineering, Fudan University School of Life Sciences, Fudan Taizhou Institute of Health Sciences, Shanghai, China; Duke Cancer Institute, Duke University Medical Center, Durham, NC, United States; East China Normal University School of Life Science, Shanghai, China; Beyster Center for Genomics of Psychiatric Diseases, Department of Psychiatry, University of California, San Diego, La Jolla, CA, United States; Department of Respiratory Disease, Shanghai Chest Hospital, Shanghai Jiaotong University, Shanghai, China","Qian J., Fudan University Shanghai Cancer Center, Department of Oncology, Fudan University Shanghai Medical College, Shanghai, China, State Key Laboratory of Genetic Engineering, Fudan University School of Life Sciences, Fudan Taizhou Institute of Health Sciences, Shanghai, China; Liu H., Duke Cancer Institute, Duke University Medical Center, Durham, NC, United States; Gu S., State Key Laboratory of Genetic Engineering, Fudan University School of Life Sciences, Fudan Taizhou Institute of Health Sciences, Shanghai, China; Wu Q., East China Normal University School of Life Science, Shanghai, China; Zhao X., State Key Laboratory of Genetic Engineering, Fudan University School of Life Sciences, Fudan Taizhou Institute of Health Sciences, Shanghai, China; Wu W., State Key Laboratory of Genetic Engineering, Fudan University School of Life Sciences, Fudan Taizhou Institute of Health Sciences, Shanghai, China, Beyster Center for Genomics of Psychiatric Diseases, Department of Psychiatry, University of California, San Diego, La Jolla, CA, United States; Wang H., State Key Laboratory of Genetic Engineering, Fudan University School of Life Sciences, Fudan Taizhou Institute of Health Sciences, Shanghai, China; Wang J., State Key Laboratory of Genetic Engineering, Fudan University School of Life Sciences, Fudan Taizhou Institute of Health Sciences, Shanghai, China; Chen H., State Key Laboratory of Genetic Engineering, Fudan University School of Life Sciences, Fudan Taizhou Institute of Health Sciences, Shanghai, China; Zhang W., Department of Respiratory Disease, Shanghai Chest Hospital, Shanghai Jiaotong University, Shanghai, China; Wei Q., Fudan University Shanghai Cancer Center, Department of Oncology, Fudan University Shanghai Medical College, Shanghai, China, Duke Cancer Institute, Duke University Medical Center, Durham, NC, United States; Jin L., State Key Laboratory of Genetic Engineering, Fudan University School of Life Sciences, Fudan Taizhou Institute of Health Sciences, Shanghai, China; Lu D., State Key Laboratory of Genetic Engineering, Fudan University School of Life Sciences, Fudan Taizhou Institute of Health Sciences, Shanghai, China","J. Qian; State Key Laboratory of Genetic Engineering, School of Life Sciences, Fudan University, Shanghai, Handan Road, 200433, China; email: jiqian@fudan.edu.cn","","Elsevier Inc.","15257304","","CLCLC","25818095","English","Clin. Lung Cancer","Article","Final","","Scopus","2-s2.0-84941418327"
"Zhao W.; Hu L.; Xu J.; Shen H.; Hu Z.; Ma H.; Shu Y.; Shao Y.; Yin Y.","Zhao, Wan (55539539100); Hu, Lingmin (36101211200); Xu, Jiali (7407000904); Shen, Hongbing (7404522651); Hu, Zhibin (8392216300); Ma, Hongxia (8624236700); Shu, Yongqian (13205662400); Shao, Yongfeng (36549340200); Yin, Yongmei (12645615800)","55539539100; 36101211200; 7407000904; 7404522651; 8392216300; 8624236700; 13205662400; 36549340200; 12645615800","Polymorphisms in the base excision repair pathway modulate prognosis of platinum-based chemotherapy in advanced non-small cell lung cancer","2013","Cancer Chemotherapy and Pharmacology","71","5","","1287","1295","8","32","10.1007/s00280-013-2127-8","https://www.scopus.com/inward/record.uri?eid=2-s2.0-84877927223&doi=10.1007%2fs00280-013-2127-8&partnerID=40&md5=5249f92472ae538c9821477e8b8364e7","Department of Oncology, BenQ Medical Center, Nanjing Medical University, Suzhou 215000, China; Department of Epidemiology and Biostatistics, School of Public Health, Nanjing Medical University, Nanjing 210029, China; Department of Oncology, First Affiliated Hospital, Nanjing Medical University, Nanjing 210029, China; Department of Thoracic and Cardiac Surgery, First Affiliated Hospital, Nanjing Medical University, Nanjing 210029, China","Zhao W., Department of Oncology, BenQ Medical Center, Nanjing Medical University, Suzhou 215000, China; Hu L., Department of Epidemiology and Biostatistics, School of Public Health, Nanjing Medical University, Nanjing 210029, China; Xu J., Department of Oncology, First Affiliated Hospital, Nanjing Medical University, Nanjing 210029, China; Shen H., Department of Epidemiology and Biostatistics, School of Public Health, Nanjing Medical University, Nanjing 210029, China; Hu Z., Department of Epidemiology and Biostatistics, School of Public Health, Nanjing Medical University, Nanjing 210029, China; Ma H., Department of Epidemiology and Biostatistics, School of Public Health, Nanjing Medical University, Nanjing 210029, China; Shu Y., Department of Oncology, First Affiliated Hospital, Nanjing Medical University, Nanjing 210029, China; Shao Y., Department of Thoracic and Cardiac Surgery, First Affiliated Hospital, Nanjing Medical University, Nanjing 210029, China; Yin Y., Department of Oncology, First Affiliated Hospital, Nanjing Medical University, Nanjing 210029, China","Y. Shao; Department of Thoracic and Cardiac Surgery, First Affiliated Hospital, Nanjing Medical University, Nanjing 210029, China; email: yongfengshao30@hotmail.com","","","14320843","","CCPHD","23479135","English","Cancer Chemother. Pharmacol.","Article","Final","","Scopus","2-s2.0-84877927223"
"Li D.-J.; Xiao D.","Li, Dan-Juan (35186171300); Xiao, Dong (57199848556)","35186171300; 57199848556","Association between the XRCC1 polymorphisms and clinical outcomes of advanced NSCLC treated with platinum-based chemotherapy: A meta-analysis based on the PRISMA statement","2017","BMC Cancer","17","1","501","","","","12","10.1186/s12885-017-3487-y","https://www.scopus.com/inward/record.uri?eid=2-s2.0-85026227101&doi=10.1186%2fs12885-017-3487-y&partnerID=40&md5=4a6d6aaec76d00e9f0f3429ba6f522c6","Nanfang Hospital, Southern Medical University, Department of Oncology, Guangzhou, 510515, China; Southern Medical University, Cancer Research Institute, Guangzhou, 510515, China","Li D.-J., Nanfang Hospital, Southern Medical University, Department of Oncology, Guangzhou, 510515, China; Xiao D., Southern Medical University, Cancer Research Institute, Guangzhou, 510515, China","D.-J. Li; Nanfang Hospital, Southern Medical University, Department of Oncology, Guangzhou, 510515, China; email: miamili@foxmail.com","","BioMed Central Ltd.","14712407","","BCMAC","28743242","English","BMC Cancer","Article","Final","All Open Access; Gold Open Access","Scopus","2-s2.0-85026227101"
"Qiu F.; Yang L.; Ling X.; Yang R.; Yang X.; Zhang L.; Fang W.; Xie C.; Huang D.; Zhou Y.; Lu J.","Qiu, Fuman (55246280100); Yang, Lei (56912498700); Ling, Xiaoxuan (56272150800); Yang, Rongrong (55645009300); Yang, Xiaorong (57666579000); Zhang, Lisha (56008339200); Fang, Wenxiang (55682494100); Xie, Chenli (55681581300); Huang, Dongsheng (57213498112); Zhou, Yifeng (12447009700); Lu, Jiachun (15048382800)","55246280100; 56912498700; 56272150800; 55645009300; 57666579000; 56008339200; 55682494100; 55681581300; 57213498112; 12447009700; 15048382800","Sequence variation in mature microRNA-499 confers unfavorable prognosis of lung cancer patients treated with platinum-based chemotherapy confers unfavorable prognosis of lung cancer patients treated with platinum-based chemotherapy","2015","Clinical Cancer Research","21","7","","1602","1613","11","27","10.1158/1078-0432.CCR-14-1174","https://www.scopus.com/inward/record.uri?eid=2-s2.0-84927586171&doi=10.1158%2f1078-0432.CCR-14-1174&partnerID=40&md5=23da6097650cef821c5bbac7476bff2f","State Key Lab of Respiratory Disease, Institute for Chemical Carcinogenesis, Guangzhou Medical University, 195 Dongfengxi Road, Guangzhou, 510182, China; Dongguan Taiping People Hospital, Dongguan, China; Department of Genetics, Medical College of Soochow University, Suzhou, China","Qiu F., State Key Lab of Respiratory Disease, Institute for Chemical Carcinogenesis, Guangzhou Medical University, 195 Dongfengxi Road, Guangzhou, 510182, China; Yang L., State Key Lab of Respiratory Disease, Institute for Chemical Carcinogenesis, Guangzhou Medical University, 195 Dongfengxi Road, Guangzhou, 510182, China; Ling X., State Key Lab of Respiratory Disease, Institute for Chemical Carcinogenesis, Guangzhou Medical University, 195 Dongfengxi Road, Guangzhou, 510182, China; Yang R., State Key Lab of Respiratory Disease, Institute for Chemical Carcinogenesis, Guangzhou Medical University, 195 Dongfengxi Road, Guangzhou, 510182, China; Yang X., State Key Lab of Respiratory Disease, Institute for Chemical Carcinogenesis, Guangzhou Medical University, 195 Dongfengxi Road, Guangzhou, 510182, China; Zhang L., State Key Lab of Respiratory Disease, Institute for Chemical Carcinogenesis, Guangzhou Medical University, 195 Dongfengxi Road, Guangzhou, 510182, China; Fang W., State Key Lab of Respiratory Disease, Institute for Chemical Carcinogenesis, Guangzhou Medical University, 195 Dongfengxi Road, Guangzhou, 510182, China; Xie C., State Key Lab of Respiratory Disease, Institute for Chemical Carcinogenesis, Guangzhou Medical University, 195 Dongfengxi Road, Guangzhou, 510182, China, Dongguan Taiping People Hospital, Dongguan, China; Huang D., State Key Lab of Respiratory Disease, Institute for Chemical Carcinogenesis, Guangzhou Medical University, 195 Dongfengxi Road, Guangzhou, 510182, China; Zhou Y., Department of Genetics, Medical College of Soochow University, Suzhou, China; Lu J., State Key Lab of Respiratory Disease, Institute for Chemical Carcinogenesis, Guangzhou Medical University, 195 Dongfengxi Road, Guangzhou, 510182, China","","","American Association for Cancer Research Inc.","10780432","","CCREF","25614447","English","Clin. Cancer Res.","Article","Final","All Open Access; Bronze Open Access; Green Open Access","Scopus","2-s2.0-84927586171"
